{
  "schemaVersion": 1,
  "id": "transfer_sh",
  "displayName": "transfer.sh",
  "description": "Upload files to transfer.sh",
  "icon": "folder-upload",
  "request": {
    "url": "https://transfer.sh",
    "method": "POST",
    "body": {
      "type": "multipart",
      "fields": {},
      "fileField": "file"
    }
  },
  "response": {
    "url": {
      "type": "text_url"
    }
  }
}
