{
  "schemaVersion": 1,
  "id": "chevereto",
  "displayName": "Chevereto",
  "description": "Upload images to a self-hosted Chevereto instance",
  "icon": "image-x-generic",
  "request": {
    "url": "https://example.invalid/api/1/upload",
    "method": "POST",
    "body": {
      "type": "multipart",
      "fields": {
        "key": "${ENV:CHEVERETO_API_KEY}",
        "format": "json"
      },
      "fileField": "source"
    }
  },
  "response": {
    "url": {
      "type": "json_pointer",
      "pointer": "/image/url_viewer"
    },
    "thumbnail": {
      "type": "json_pointer",
      "pointer": "/image/thumb/url"
    },
    "error": {
      "type": "json_pointer",
      "pointer": "/error/message"
    }
  },
  "accept": {
    "mimeTypes": [
      "image/*"
    ],
    "extensions": [
      "jpg",
      "jpeg",
      "png",
      "gif",
      "webp"
    ]
  }
}
